{
  "$schema": "./rules.schema.json",
  "version": "2.0",
  "source_file": "01_SABLONA_v2.xlsx",
  "generated_at": "2026-06-02T20:07:54",
  "global_invariants": [
    "Nevymýšľať ceny — vždy ich dodá klient.",
    "Nevymýšľať recenzie, mená ani hodnotenia.",
    "Nemeniť fakty, čísla, legislatívu, technické parametre ani poradie fotiek.",
    "Nemeniť brand farby, fonty, layout ani štruktúru menu.",
    "CTA default max 21 znakov; nepoužívať „Kliknite sem / Viac / Tu / Kúpte hneď\"."
  ],
  "tool_routing": {
    "foto": "Image 2.0 (cez n8n)",
    "video": "Runway (cez n8n)",
    "text": "Claude",
    "recenzie": "Google Reviews API",
    "podklady_klienta": "Google Drive"
  },
  "pages": {
    "hp": {
      "sheet": "HP",
      "elementor_target": "Hp",
      "intro_notes": [],
      "sections": [
        {
          "order": "1",
          "slot_id": "hp.navigacia",
          "stav": "POVINNÁ",
          "name": "Navigacia",
          "element_types": "Logo, menu, CTA",
          "item_count": {
            "raw": "1 logo, variabilne menu, 1 CTA",
            "min": 1,
            "max": 1,
            "unlimited": false
          },
          "visual_type": "Logo klienta",
          "visual_count": "1x logo",
          "ai_can_edit": [
            "Logo",
            "CTA text",
            "menu polozky"
          ],
          "ai_cannot_edit": [
            "Struktura menu",
            "farby"
          ],
          "data_source": [
            "Formular klienta - Zoznam stranok webu"
          ],
          "rules_text": null,
          "constraints": {}
        },
        {
          "order": "2",
          "slot_id": "hp.hero_sekcia",
          "stav": "POVINNÁ",
          "name": "Hero sekcia",
          "element_types": "H1 nadpis, CTA, statistiky, hlavny vizual",
          "item_count": {
            "raw": "1 H1, 1 podnadpis, 1 CTA, 3 statistiky",
            "min": 1,
            "max": 1,
            "unlimited": false
          },
          "visual_type": "FOTO alebo VIDEO",
          "visual_count": "1 hlavny vizual",
          "ai_can_edit": [
            "H1",
            "podnadpis",
            "CTA",
            "statistiky",
            "vizual"
          ],
          "ai_cannot_edit": [
            "Rozlozenie",
            "farby",
            "fonty"
          ],
          "data_source": [
            "Claude",
            "Runway alebo klientove foto"
          ],
          "rules_text": null,
          "constraints": {}
        },
        {
          "order": "3",
          "slot_id": "hp.nase_sluzby_karty",
          "stav": "POVINNÁ",
          "name": "Nase sluzby (karty)",
          "element_types": "Nadpis sekcie, podnadpis, karty sluzieb",
          "item_count": {
            "raw": "1 nadpis, 1 podnadpis, min. 2 max. 8 kariet",
            "min": 2,
            "max": 8,
            "unlimited": false
          },
          "visual_type": "FOTO alebo IKONA",
          "visual_count": "1 vizual na kartu",
          "ai_can_edit": [
            "Nazov sluzby",
            "popis",
            "vizual"
          ],
          "ai_cannot_edit": [
            "Pocet kariet",
            "layout"
          ],
          "data_source": [
            "Claude",
            "klientove podklady"
          ],
          "rules_text": null,
          "constraints": {}
        },
        {
          "order": "4",
          "slot_id": "hp.sluzba_blok_1_vpravo",
          "stav": "POVINNÁ",
          "name": "Sluzba blok 1 (vpravo)",
          "element_types": "H2, text, CTA + vizualna cast (2 sloty)",
          "item_count": {
            "raw": "1 H2, 1 text, 1 CTA, 2 vizualne sloty",
            "min": 1,
            "max": 1,
            "unlimited": false
          },
          "visual_type": "FOTO alebo VIDEO",
          "visual_count": "Slot A + Slot B",
          "ai_can_edit": [
            "H2",
            "text",
            "CTA",
            "oba vizualy"
          ],
          "ai_cannot_edit": [
            "Rozlozenie vlavo",
            "vpravo",
            "farby"
          ],
          "data_source": [
            "Claude",
            "GDrive",
            "Runway"
          ],
          "rules_text": null,
          "constraints": {}
        },
        {
          "order": "5",
          "slot_id": "hp.sluzba_blok_2_vlavo",
          "stav": "POVINNÁ",
          "name": "Sluzba blok 2 (vlavo)",
          "element_types": "H2, text, CTA + vizualna cast (2 sloty)",
          "item_count": {
            "raw": "1 H2, 1 text, 1 CTA, 2 vizualne sloty",
            "min": 1,
            "max": 1,
            "unlimited": false
          },
          "visual_type": "FOTO alebo VIDEO",
          "visual_count": "Slot A + Slot B",
          "ai_can_edit": [
            "H2",
            "text",
            "CTA",
            "oba vizualy"
          ],
          "ai_cannot_edit": [
            "Rozlozenie vlavo",
            "vpravo",
            "farby"
          ],
          "data_source": [
            "Claude",
            "GDrive",
            "Runway"
          ],
          "rules_text": null,
          "constraints": {}
        },
        {
          "order": "6",
          "slot_id": "hp.sluzba_blok_3_vpravo",
          "stav": "POVINNÁ",
          "name": "Sluzba blok 3 (vpravo)",
          "element_types": "H2, text, CTA + vizualna cast (2 sloty)",
          "item_count": {
            "raw": "1 H2, 1 text, 1 CTA, 2 vizualne sloty",
            "min": 1,
            "max": 1,
            "unlimited": false
          },
          "visual_type": "FOTO alebo VIDEO",
          "visual_count": "Slot A + Slot B",
          "ai_can_edit": [
            "H2",
            "text",
            "CTA",
            "oba vizualy"
          ],
          "ai_cannot_edit": [
            "Rozlozenie vlavo",
            "vpravo",
            "farby"
          ],
          "data_source": [
            "Claude",
            "GDrive",
            "Runway"
          ],
          "rules_text": null,
          "constraints": {}
        },
        {
          "order": "7",
          "slot_id": "hp.sluzba_blok_4_vlavo",
          "stav": "POVINNÁ",
          "name": "Sluzba blok 4 (vlavo)",
          "element_types": "H2, text, CTA + vizualna cast (2 sloty)",
          "item_count": {
            "raw": "1 H2, 1 text, 1 CTA, 2 vizualne sloty",
            "min": 1,
            "max": 1,
            "unlimited": false
          },
          "visual_type": "FOTO alebo VIDEO",
          "visual_count": "Slot A + Slot B",
          "ai_can_edit": [
            "H2",
            "text",
            "CTA",
            "oba vizualy"
          ],
          "ai_cannot_edit": [
            "Rozlozenie vlavo",
            "vpravo",
            "farby"
          ],
          "data_source": [
            "Claude",
            "GDrive",
            "Runway"
          ],
          "rules_text": null,
          "constraints": {}
        },
        {
          "order": "8",
          "slot_id": "hp.sluzba_blok_5_vpravo",
          "stav": "POVINNÁ",
          "name": "Sluzba blok 5 (vpravo)",
          "element_types": "H2, text, CTA + vizualna cast (2 sloty)",
          "item_count": {
            "raw": "1 H2, 1 text, 1 CTA, 2 vizualne sloty",
            "min": 1,
            "max": 1,
            "unlimited": false
          },
          "visual_type": "FOTO alebo VIDEO",
          "visual_count": "Slot A + Slot B",
          "ai_can_edit": [
            "H2",
            "text",
            "CTA",
            "oba vizualy"
          ],
          "ai_cannot_edit": [
            "Rozlozenie vlavo",
            "vpravo",
            "farby"
          ],
          "data_source": [
            "Claude",
            "GDrive",
            "Runway"
          ],
          "rules_text": null,
          "constraints": {}
        },
        {
          "order": "9",
          "slot_id": "hp.sluzba_blok_6_vlavo",
          "stav": "POVINNÁ",
          "name": "Sluzba blok 6 (vlavo)",
          "element_types": "H2, text, CTA + vizualna cast (2 sloty)",
          "item_count": {
            "raw": "1 H2, 1 text, 1 CTA, 2 vizualne sloty",
            "min": 1,
            "max": 1,
            "unlimited": false
          },
          "visual_type": "FOTO alebo VIDEO",
          "visual_count": "Slot A + Slot B",
          "ai_can_edit": [
            "H2",
            "text",
            "CTA",
            "oba vizualy"
          ],
          "ai_cannot_edit": [
            "Rozlozenie vlavo",
            "vpravo",
            "farby"
          ],
          "data_source": [
            "Claude",
            "GDrive",
            "Runway"
          ],
          "rules_text": null,
          "constraints": {}
        },
        {
          "order": "10",
          "slot_id": "hp.video_sekcia",
          "stav": "POVINNÁ",
          "name": "Video sekcia",
          "element_types": "H2, podnadpis, video",
          "item_count": {
            "raw": "1 H2, 1 podnadpis, 1 video",
            "min": 1,
            "max": 1,
            "unlimited": false
          },
          "visual_type": "VIDEO",
          "visual_count": "1 video",
          "ai_can_edit": [
            "H2",
            "podnadpis",
            "video"
          ],
          "ai_cannot_edit": [
            "Rozlozenie playera",
            "farby"
          ],
          "data_source": [
            "Runway",
            "Claude"
          ],
          "rules_text": null,
          "constraints": {}
        },
        {
          "order": "11",
          "slot_id": "hp.galeria",
          "stav": "POVINNÁ",
          "name": "Galeria",
          "element_types": "Nadpis sekcie, fotky",
          "item_count": {
            "raw": "1 nadpis, 3-12 fotiek",
            "min": 3,
            "max": 12,
            "unlimited": false
          },
          "visual_type": "FOTO",
          "visual_count": "3-12 fotiek",
          "ai_can_edit": [